{
  "aspec_version": "1.0",
  "metadata": {
    "name": "Save New Gmail Messages to Spreadsheet",
    "description": "Sort my Gmail. Every 13 minutes, save the body of every new email to a Google spreadsheet called messages in a tab named sheet1. Every email body should appear only in the Message column as a new row. Save every email as it arrives.",
    "created_at": "2026-06-09T18:12:41.593509Z",
    "tags": []
  },
  "credentials": {
    "gmailOAuth2": {
      "auth_type": "gmailOAuth2",
      "service": "gmail",
      "credential_id": "mock-cred-gmail",
      "status": "ok"
    },
    "googleSheetsOAuth2Api": {
      "auth_type": "googleSheetsOAuth2Api",
      "service": "google_sheets",
      "credential_id": "mock-cred-google-sheets",
      "status": "ok"
    }
  },
  "resources": {
    "google_sheets_spreadsheet": {
      "service": "google_sheets",
      "type": "spreadsheet",
      "id": "mock-sheet-messages",
      "name": "Messages",
      "details": {
        "sheets": [
          {
            "title": "Sheet1",
            "index": 0,
            "rowCount": 1000,
            "columnCount": 26,
            "columns": [
              "message"
            ]
          }
        ]
      }
    }
  },
  "trigger": {
    "step_id": "trigger_1",
    "adapter_id": "email.trigger.gmail",
    "adapter_name": "Gmail Trigger",
    "service": "gmail",
    "is_trigger": true,
    "configured_parameters": {
      "folder": "inbox",
      "pollTimes": "custom",
      "filters": {}
    },
    "parameter_origin": {
      "folder": "inferred",
      "pollTimes": "user",
      "filters": "user"
    },
    "credential_ref": "gmailOAuth2",
    "trigger_mode": "polling",
    "outputs": [
      "email_object"
    ]
  },
  "steps": [
    {
      "step_id": "step_1",
      "adapter_id": "spreadsheet.append.google_sheets",
      "adapter_name": "Google Sheets Append",
      "service": "google_sheets",
      "is_trigger": false,
      "configured_parameters": {
        "documentId": "mock-sheet-messages",
        "operation": "append",
        "convertFieldsToString": false,
        "sheetName": "sheet1",
        "columns": {
          "message": "{{email_object.body}}"
        }
      },
      "parameter_origin": {
        "documentId": "system",
        "operation": "inferred",
        "convertFieldsToString": "inferred",
        "sheetName": "user",
        "columns": "user"
      },
      "credential_ref": "googleSheetsOAuth2Api",
      "outputs": [
        "append_result"
      ],
      "input_from": "trigger_1"
    }
  ],
  "connections": [
    {
      "from": "trigger_1",
      "to": "step_1",
      "type": "main"
    }
  ]
}