{
  "aspec_version": "1.0.0",
  "metadata": {
    "name": "Expense row email notification",
    "description": "When a new row is added to the Expenses Google Sheet, send a Gmail notification to expenses@acmecorp.com and label the sent email as Expenses."
  },
  "credentials": {
    "gmail": {
      "auth_type": "gmailOAuth2",
      "service": "gmail",
      "credential_id": "mock-cred-gmail",
      "status": "ok"
    },
    "google_sheets_trigger": {
      "auth_type": "googleSheetsTriggerOAuth2Api",
      "service": "google_sheets",
      "credential_id": "mock-cred-google-sheets-trigger",
      "status": "ok"
    }
  },
  "resources": {
    "expenses_sheet": {
      "service": "google_sheets",
      "type": "spreadsheet",
      "id": "mock-sheet-expenses",
      "name": "Expenses",
      "details": {
        "resource_type": "application/vnd.google-apps.spreadsheet",
        "sheets": [
          {
            "title": "Sheet1",
            "index": 0,
            "rowCount": 1000,
            "columnCount": 26
          }
        ],
        "columns": [
          "Expense name",
          "Expense amount",
          "Expense date"
        ]
      }
    }
  },
  "trigger": {
    "step_id": "trigger_expense_row_added",
    "adapter_id": "spreadsheet.trigger.google_sheets",
    "adapter_name": "Google Sheets Trigger",
    "service": "google_sheets",
    "description": "Triggers when a new expense row is added to the Expenses sheet.",
    "is_trigger": true,
    "trigger_mode": "polling",
    "outputs": [
      "row_object"
    ],
    "credential_ref": "google_sheets_trigger",
    "configured_parameters": {
      "pollTimes": "everyMinute",
      "documentId": "mock-sheet-expenses",
      "sheetName": "Sheet1",
      "event": "rowAdded"
    },
    "parameter_origin": {
      "pollTimes": "default",
      "documentId": "user",
      "sheetName": "default",
      "event": "default"
    }
  },
  "steps": [
    {
      "step_id": "send_expense_email",
      "adapter_id": "email.send.gmail",
      "adapter_name": "Send Email via Gmail",
      "service": "gmail",
      "description": "Sends an email with the new expense details.",
      "input_from": "trigger_expense_row_added",
      "outputs": [
        "send_result"
      ],
      "credential_ref": "gmail",
      "configured_parameters": {
        "sendTo": "expenses@acmecorp.com",
        "subject": "Expense added",
        "emailType": "text",
        "message": "An expense has been added to the expenses sheet. The name is {{$json.row[\"Expense name\"]}}, the amount is {{$json.row[\"Expense amount\"]}}, and the date is {{$json.row[\"Expense date\"]}}."
      },
      "parameter_origin": {
        "sendTo": "user",
        "subject": "user",
        "emailType": "default",
        "message": "user"
      }
    },
    {
      "step_id": "label_expense_email",
      "adapter_id": "email.label.gmail",
      "adapter_name": "Add Label to Gmail Message",
      "service": "gmail",
      "description": "Labels the sent email with the Expenses Gmail label.",
      "input_from": "send_expense_email",
      "outputs": [
        "label_result"
      ],
      "credential_ref": "gmail",
      "configured_parameters": {
        "messageId": "{{$json.messageId}}",
        "labelIds": [
          "Label_expenses"
        ]
      },
      "parameter_origin": {
        "messageId": "inferred",
        "labelIds": "user"
      }
    }
  ],
  "connections": [
    {
      "from": "trigger_expense_row_added",
      "to": "send_expense_email",
      "type": "main"
    },
    {
      "from": "send_expense_email",
      "to": "label_expense_email",
      "type": "main"
    }
  ]
}